{
  "schemaVersion": "1.0",
  "kind": "evaluation-protocol",
  "frozenBaseline": ["rules-only", "native"],
  "splitPolicy": "repository-and-time",
  "annotationInstruction": "A gold label needs observable evidence or an adjudicated review. Holdout holdout-empty-2026-09-23 is empty and later quality work must not re-optimize against it.",
  "sourceCorpus": false,
  "trainer": false,
  "holdoutId": "holdout-empty-2026-09-23",
  "qualityGate": "not-passed",
  "labelledCorpus": false
}
